source,author,title,description,url,urlToImage,publishedAt,content
"{'id': None, 'name': 'CoinDesk'}",Shaurya Malwa,Bitcoin miner MARA sold $1.5 billion of bitcoin as it shifts toward AI infrastructure,"While the miner said bitcoin remains its operational foundation, first-quarter results point to a company increasingly built around power, data centers and AI demand.",https://www.coindesk.com/markets/2026/05/12/bitcoin-miner-mara-sold-usd1-5-billion-of-bitcoin-as-it-shifts-toward-ai-infrastructure,https://cdn.sanity.io/images/s3y3vcno/production/d131b13d968da3a728396e698cdb5ddc75273bdf-3999x2666.jpg?auto=format&w=960&h=540&crop=focalpoint&fit=clip&q=75&fm=jpg,2026-05-12T07:42:05Z,"MARA Holdings (MARA) is still producing bitcoin BTC
$80,984.66, but it is getting harder to argue that mining is its core business.
In its first-quarter earnings statement, the company said it does… [+2106 chars]"
"{'id': None, 'name': 'Yahoo Entertainment'}",,"Bitcoin and ethereum price today, Monday, May 4, 2026: Bitcoin tops $80,000, then pulls back",,https://consent.yahoo.com/v2/collectConsent?sessionId=1_cc-session_1615380e-2b3b-4cc9-bf99-8f67bc435fb4,,2026-05-04T11:45:47Z,"If you click 'Accept all', we and our partners, including 250 who are part of the IAB Transparency &amp; Consent Framework, will also store and / or access information on a device (in other words, us… [+1046 chars]"
"{'id': None, 'name': 'Yahoo Entertainment'}",,Jim Cramer on Strategy Inc: “You Want to Own Bitcoin? Buy Bitcoin”,,https://consent.yahoo.com/v2/collectConsent?sessionId=1_cc-session_d6ad6365-d03f-4b41-82e6-b84e5cef69f1,,2026-05-04T18:21:22Z,"If you click 'Accept all', we and our partners, including 250 who are part of the IAB Transparency &amp; Consent Framework, will also store and / or access information on a device (in other words, us… [+1046 chars]"
"{'id': None, 'name': 'Yahoo Entertainment'}",,Bitcoin (BTC) News: Saylor Says Strategy Will Buy 20x More Bitcoin Than It Sells,,https://consent.yahoo.com/v2/collectConsent?sessionId=1_cc-session_a4f2f1a6-0866-4be6-b469-e5aff89a0096,,2026-05-11T11:43:14Z,"If you click 'Accept all', we and our partners, including 249 who are part of the IAB Transparency &amp; Consent Framework, will also store and / or access information on a device (in other words, us… [+1046 chars]"
"{'id': None, 'name': 'Yahoo Entertainment'}",,"Bitcoin and ethereum prices today, Tuesday, May 12, 2026: Bitcoin and ethereum prices backing off",,https://consent.yahoo.com/v2/collectConsent?sessionId=1_cc-session_3c8793b3-0db0-4ef9-9db5-733b638da3ef,,2026-05-12T11:33:24Z,"If you click 'Accept all', we and our partners, including 249 who are part of the IAB Transparency &amp; Consent Framework, will also store and / or access information on a device (in other words, us… [+1046 chars]"
"{'id': None, 'name': 'Yahoo Entertainment'}",,CME Is Launching a Bitcoin VIX: Here’s Why That Changes Wall Street’s Bitcoin Game,,https://consent.yahoo.com/v2/collectConsent?sessionId=1_cc-session_1d59eed3-abb1-4167-888d-d87c2c6c6baa,,2026-05-12T09:45:39Z,"If you click 'Accept all', we and our partners, including 249 who are part of the IAB Transparency &amp; Consent Framework, will also store and / or access information on a device (in other words, us… [+1046 chars]"
"{'id': None, 'name': 'Yahoo Entertainment'}",,BITU’s Decay Problem: Why This Bitcoin ETF Lost 31% While Bitcoin Fell Just 10%,,https://consent.yahoo.com/v2/collectConsent?sessionId=1_cc-session_ecdcbbd0-a6cd-45e5-a081-d2ad4a2350d6,,2026-05-06T11:15:49Z,"If you click 'Accept all', we and our partners, including 250 who are part of the IAB Transparency &amp; Consent Framework, will also store and / or access information on a device (in other words, us… [+1046 chars]"
"{'id': None, 'name': 'Yahoo Entertainment'}",,Tim Draper Says Firms ‘Irresponsible’ To Not Hold Bitcoin as Bullish Predictions Surge At Bitcoin 2026,,https://consent.yahoo.com/v2/collectConsent?sessionId=1_cc-session_f98112cf-8fe9-47d2-9804-46c7cea8f0f7,,2026-04-28T14:17:15Z,"If you click 'Accept all', we and our partners, including 250 who are part of the IAB Transparency &amp; Consent Framework, will also store and / or access information on a device (in other words, us… [+1046 chars]"
"{'id': None, 'name': 'Yahoo Entertainment'}",,Bitcoin News: Strategy Just Passed BlackRock as the Largest Bitcoin Holder in the World,,https://consent.yahoo.com/v2/collectConsent?sessionId=1_cc-session_b76ae23d-4d43-4606-93df-fe127691d17d,,2026-04-21T17:13:53Z,"If you click 'Accept all', we and our partners, including 250 who are part of the IAB Transparency &amp; Consent Framework, will also store and / or access information on a device (in other words, us… [+1046 chars]"
"{'id': None, 'name': 'Yahoo Entertainment'}",Tim Manni,"Bitcoin and ethereum prices today, Tuesday, May 12, 2026: Bitcoin and ethereum prices move l","Bitcoin opened at $81,721.41 on Tuesday, down 0.5% from Monday's opening price of $82,164.43. Ethereum opened at $2,339.40 on Tuesday, down 1.3% from...",https://finance.yahoo.com/personal-finance/investing/article/bitcoin-and-ethereum-prices-today-tuesday-may-12-2026-bitcoin-and-ethereum-prices-mv-113324235.html,https://s.yimg.com/uu/api/res/1.2/R4fhNy.vnr_QIatr9RUOpQ--~B/aD00MDU7dz02MTI7YXBwaWQ9eXRhY2h5b24-/https://d29szjachogqwa.cloudfront.net/images/user-uploaded/ethereum_%20_bitcoin_2_2928.jpg,2026-05-12T11:33:24Z,"Bitcoin (BTC-USD) was down over 1% to $80,389.00 on Tuesday, following a hotter-than-expected CPI report showing consumer prices rose in April, as the Iran war pressured global fuel and food costs.
… [+2943 chars]"
"{'id': None, 'name': 'Yahoo Entertainment'}",,"Bitcoin and ethereum prices today, Thursday, May 14, 2026: Bitcoin and ethereum prices slipping this week",,https://consent.yahoo.com/v2/collectConsent?sessionId=1_cc-session_e9dfc74c-84c5-4498-9f8d-062ee0813a76,,2026-05-14T11:19:38Z,"If you click 'Accept all', we and our partners, including 247 who are part of the IAB Transparency &amp; Consent Framework, will also store and / or access information on a device (in other words, us… [+1046 chars]"
"{'id': None, 'name': 'CoinDesk'}",Olivier Acuna,"Price of bitcoin could go higher or ‘can go to zero,’ says Czech central bank governor","Alex Michl spoke at the Bitcoin 2026 conference and said his bank did a study that found bitcoin outperformed all assets, including gold, but that it 'honestly looks too risky.'",https://www.coindesk.com/markets/2026/04/29/price-of-bitcoin-could-go-higher-or-can-go-to-zero-says-czech-central-bank-governor,https://cdn.sanity.io/images/s3y3vcno/production/3343bd5e049a9fa2bb623680733a41f6c44169f7-2048x1330.jpg?auto=format&w=960&h=540&crop=focalpoint&fit=clip&q=75&fm=jpg,2026-04-29T12:11:14Z,"The Czech Republics central bank governor, Alex Michl, said that adding bitcoin BTC
$77,200.59 to the financial institutions reserves could improve performance, but warned its volatility is much hig… [+1916 chars]"
"{'id': None, 'name': 'CoinDesk'}",Olivier Acuna,"Michael Saylor says the bitcoin winter is over. Some experts agree, with caveats.","Market analyst Mati Greenspan said bitcoin has not gone through a “winter,” rather a pullback within a broader bull market, adding the next leg up for bitcoin will be driven by nation-state adoption.",https://www.coindesk.com/markets/2026/04/23/michael-saylor-says-the-bitcoin-winter-is-over-some-experts-agree-with-caveats,https://cdn.sanity.io/images/s3y3vcno/production/dbb2fea217b52998d1955532b0481c1c36b133c8-1152x648.jpg?auto=format&w=960&h=540&crop=focalpoint&fit=clip&q=75&fm=jpg,2026-04-24T10:03:36Z,"Michael Saylor, executive chairman of Strategy (MSTR), the largest publicly traded holder of bitcoin BTC
$77,716.43, said Thursday on X that the crypto winter is over as bitcoin held above $78,000, … [+3019 chars]"
"{'id': None, 'name': 'DIE WELT'}","Daniel Eckert,Michael Höfling,Karsten Seibel",Dem Steuervorteil beim Bitcoin droht das Aus – was Krypto-Investoren jetzt noch tun können,"Wer Gewinne mit Bitcoin und anderen digitalen Münzen erzielt, muss sie nach einem Jahr nicht mehr versteuern. Nach der SPD wollen jetzt auch Grüne und Linke diese „Gerechtigkeitslücke“ schließen – wie sie es nennen. WELT erklärt, was auf Krypto-Sparer zukommt…",https://www.welt.de/finanzen/plus69fc409530e98e4ac324ce9a/steuervorteil-beim-bitcoin-droht-das-aus-was-krypto-investoren-jetzt-noch-tun-koennen.html,https://images.welt.de/69fc409530e98e4ac324ce9a/3b6f7358a031299d45142f53a9d7479a-master/ci16x9-w1200/gettyimages-1325823070-1-jpg,2026-05-08T12:06:53Z,"Wer Gewinne mit Bitcoin und anderen digitalen Münzen erzielt, muss sie nach einem Jahr nicht mehr versteuern. Nach der SPD wollen jetzt auch Grüne und Linke diese Gerechtigkeitslücke schließen wie si… [+85 chars]"
"{'id': None, 'name': 'CoinDesk'}",Ian Allison,"Institutional money is coming for bitcoin, but Adam Back says it moves slower than you think",The legendary cryptographer discusses institutional money flows into bitcoin.,https://www.coindesk.com/business/2026/04/29/institutional-money-is-coming-for-bitcoin-but-adam-back-says-it-moves-slower-than-you-think,https://cdn.sanity.io/images/s3y3vcno/production/c72a7d7906fb5fbc62478d497a1a0b6acf914bb5-2048x1365.jpg?auto=format&w=960&h=540&crop=focalpoint&fit=clip&q=75&fm=jpg,2026-04-29T04:00:00Z,"The arrival of Morgan Stanley at the U.S. spot bitcoin BTC
$77,047.14 ETF party earlier this month was characterized by some observers as the catalyst that will end the current crypto bear market th… [+5308 chars]"
"{'id': None, 'name': 'Yahoo Entertainment'}",Brian Sozzi,Bitcoin's comeback won't happen in 2026: Deutsche Bank survey of consumers,Deutsche Bank's new crypto survey is decidedly bearish for bitcoin.,https://finance.yahoo.com/news/bitcoins-comeback-wont-happen-in-2026-deutsche-bank-survey-of-consumers-134056305.html,https://s.yimg.com/ny/api/res/1.2/.Z5tyxKY78q5nSzRFNKQXQ--/YXBwaWQ9aGlnaGxhbmRlcjt3PTEyMDA7aD03NjQ-/https://s.yimg.com/os/creatr-uploaded-images/2021-04/5af69a20-a8e5-11eb-bf7f-5f2e9fe992ce,2026-04-20T13:40:56Z,"The forgotten bitcoin bull trade.
While the S&amp;P 500 (^GSPC) has climbed to fresh records above 7,000 this month, bitcoin has done anything but regain the upward momentum that thrust the digital … [+2397 chars]"
"{'id': None, 'name': 'taz.de'}",Hannes Koch,Kapitalertragssteuer oder was: Da freut sich die Bitcoin-Gemeinde,"Die Bundesregierung erwägt, Krypto-Finanzanlagen anders zu besteuern. Grüne und Linke bringen Initiativen in den Bundestag ein.",https://taz.de/Kapitalertragssteuer-oder-was/!6178670/,https://taz.de/picture/8435315/1200/41131106.jpeg,2026-05-12T15:53:00Z,"Die Bundesregierung erwägt, Krypto-Finanzanlagen anders zu besteuern. Grüne und Linke bringen Initiativen in den Bundestag ein. mehr..."
"{'id': None, 'name': 'CoinDesk'}",Shaurya Malwa,Strategy pauses bitcoin buys before Tuesday earnings,"Michael Saylor says the company will resume purchases next week, but the pause lands as analysts focus on losses and the growing complexity of Strategy’s preferred-stock funding machine.",https://www.coindesk.com/business/2026/05/04/strategy-pauses-bitcoin-buys-before-tuesday-earnings,https://cdn.sanity.io/images/s3y3vcno/production/8a5dba87ad94ba079e2f4c60317ed8bbef4fb85e-1920x1080.png?auto=format&w=960&h=540&crop=focalpoint&fit=clip&q=75&fm=jpg,2026-05-04T05:14:53Z,"Strategy is taking a breather from buying bitcoin.
Michael Saylor said Sunday the company would not add to its bitcoin holdings this week, pausing its regular purchase program ahead of Tuesdays firs… [+2562 chars]"
"{'id': None, 'name': 'CoinDesk'}",Omkar Godbole,Clarity Act markup leaves bitcoin unstirred,"The day ahead in crypto: May 14, 2026",https://www.coindesk.com/daybook-us/2026/05/14/clarity-act-markup-leaves-bitcoin-unstirred,https://cdn.sanity.io/images/s3y3vcno/production/01c91bc3b572d3fa729dbeab3c0da632ed261d7f-1500x1000.jpg?auto=format&w=960&h=540&crop=focalpoint&fit=clip&q=75&fm=jpg,2026-05-14T11:26:43Z,"This is an excerpt from CoinDesk newsletter 'Daybook.'Sign up here, if you haven't already.
The week's main event for digital assets, the U.S. Clarity Act markup, is due later today. The crypto mark… [+3210 chars]"
"{'id': None, 'name': 'Yahoo Entertainment'}",,Better Buy: Bitcoin (BTC) or Bittensor (TAO)?,,https://consent.yahoo.com/v2/collectConsent?sessionId=1_cc-session_79ae69e2-b22c-48ab-ae96-fb439806e09b,,2026-04-18T19:01:00Z,"If you click 'Accept all', we and our partners, including 251 who are part of the IAB Transparency &amp; Consent Framework, will also store and / or access information on a device (in other words, us… [+1046 chars]"
"{'id': None, 'name': 'Yahoo Entertainment'}",,Morning Minute: Saylor's $2.54B Buy Buoys Bitcoin,,https://consent.yahoo.com/v2/collectConsent?sessionId=1_cc-session_aa50d78d-10a6-4fc6-9d35-a0157fd3b506,,2026-04-21T11:51:42Z,"If you click 'Accept all', we and our partners, including 250 who are part of the IAB Transparency &amp; Consent Framework, will also store and / or access information on a device (in other words, us… [+1046 chars]"
"{'id': None, 'name': 'Yahoo Entertainment'}",,Bitcoin: Still the Strongest Moat in Crypto,,https://consent.yahoo.com/v2/collectConsent?sessionId=1_cc-session_762116f9-3fde-4ddd-b79b-3516cdadb14b,,2026-04-21T10:02:00Z,"If you click 'Accept all', we and our partners, including 250 who are part of the IAB Transparency &amp; Consent Framework, will also store and / or access information on a device (in other words, us… [+1046 chars]"
"{'id': None, 'name': 'Yahoo Entertainment'}",,Bitcoin Heads For Fourth Weekly Gain,,https://consent.yahoo.com/v2/collectConsent?sessionId=1_cc-session_bc254a44-eb63-426e-96e6-03a1b06e1d3f,,2026-04-24T13:53:00Z,"If you click 'Accept all', we and our partners, including 250 who are part of the IAB Transparency &amp; Consent Framework, will also store and / or access information on a device (in other words, us… [+1046 chars]"
"{'id': None, 'name': 'Yahoo Entertainment'}",,CryptoQuant CEO Warns Bitcoin Demand Imbalance,,https://consent.yahoo.com/v2/collectConsent?sessionId=1_cc-session_80b9cdc6-b4c7-45ab-8595-4e5dbc42d3c8,,2026-04-27T12:04:32Z,"If you click 'Accept all', we and our partners, including 250 who are part of the IAB Transparency &amp; Consent Framework, will also store and / or access information on a device (in other words, us… [+1046 chars]"
"{'id': None, 'name': 'Yahoo Entertainment'}",,Where Will Bitcoin Be in 3 Years?,,https://consent.yahoo.com/v2/collectConsent?sessionId=1_cc-session_45915758-cec3-4127-b6e0-db3811df4a95,,2026-04-29T21:57:00Z,"If you click 'Accept all', we and our partners, including 250 who are part of the IAB Transparency &amp; Consent Framework, will also store and / or access information on a device (in other words, us… [+1046 chars]"
"{'id': None, 'name': 'Yahoo Entertainment'}",,Where Will Bitcoin Be in 5 Years?,,https://consent.yahoo.com/v2/collectConsent?sessionId=1_cc-session_c91c81d0-0bed-4d29-b575-ef2efde4cc2e,,2026-04-19T10:35:00Z,"If you click 'Accept all', we and our partners, including 251 who are part of the IAB Transparency &amp; Consent Framework, will also store and / or access information on a device (in other words, us… [+1046 chars]"
"{'id': None, 'name': 'Yahoo Entertainment'}",,"Could Bitcoin Actually Hit $200,000 Before 2028?",,https://consent.yahoo.com/v2/collectConsent?sessionId=1_cc-session_69b6359f-b36a-4677-8fb3-01b7d707113c,,2026-04-18T07:25:00Z,"If you click 'Accept all', we and our partners, including 251 who are part of the IAB Transparency &amp; Consent Framework, will also store and / or access information on a device (in other words, us… [+1046 chars]"
